<?xml version="1.0" encoding="UTF-8"?>
<!-- SLL eRemiss testcase 2 -->
<request xmlns:gcda="AlschulerAssociates::GreenCDA" xmlns:gcdan="AlschulerAssociates::GreenCDA::Narrative" xmlns="urn:riv:clinicalprocess:requestworkflow:request"
         xsi:schemaLocation="urn:riv:clinicalprocess:requestworkflow:request remiss.xsd" xmlns:xsi="http://www.w3.org/2001/XMLSchema-instance">
             
    <requestId root="1.2.752.129.2.1.2.1" extension="testfall2"/>
    <typeOfRequest code="4" codeSystem="1.2.752.129.2.2.2.24"/>
    <versionTimeStamp value="201203121636"/>
    <versionNumber>1</versionNumber>
    <reasonForVersion>
        <typeOfReason code="VR" codeSystem="1.2.752.97.3.2.8.5"/>
        <text>Remissen skickas vidare till er då patienten är listad hos er.</text>
    </reasonForVersion>
    
    <!-- Patient -->
    <patient>
        <personId root="1.2.752.97.3.1.2" extension="197907179191"/>
        <address>
            <careOf>Mikkonen</careOf>
            <streetName1>Astrakangatan 14</streetName1>
            <postalCode>16565</postalCode>
            <postalCity>Hässelby</postalCity>
        </address>
        <telecom>
            <typeOfTelecom code="MC" codeSystem="1.2.752.129.2.2.1.30"/>
            <number>+46706123123</number>
        </telecom>
        <!-- Efternamn/mellannamn/tilltalsnamn/förnamn -->
        <name>Testsson//Vårdtest</name>
        <gender code="1" codeSystem="1.2.752.129.2.2.1.1"/>
        <dateOfBirth value="19790917"/>
    </patient>

    <author>
        <dateOfRequest value="20120312"/>
        <staff>
            <id root="1.2.752.129.2.1.4.1" extension="HSAid"/>
            <name>Elin Ek</name>
        </staff>
        <typeOfStaff code="LK" codeSystem="1.2.752.97.3.2.8.8"/>
        <staffOrganisation>
            <careUnitId root="1.2.752.129.2.1.4.1" extension="HSAid"/>
            <careUnitName>Avd 33, Medicinkliniken, Capio S:t Görans sjukhus</careUnitName>
        </staffOrganisation>
        <legalAuthenticator>  
            <timeOfSigning value="201203121344"/>
            <signature>
                <id root="1.2.752.129.2.1.4.1" extension="HSAid" />
                <name>Elin EK, AT-läkare</name>
            </signature>
        </legalAuthenticator>
    </author>
    
    <recipient>
        <organisation>
            <careUnitId root="1.2.752.129.2.1.4.1" extension="HSAid"/>
            <careUnitName>Råcksta-Vällingby närvårdsmottagning</careUnitName>
        </organisation>
    </recipient>
    
    <!-- Not used in this testcase
    <participant>
    </participant>
    -->
    
    <!-- Remissförmedlare -->
    <intermediary>
        <staff>
            <id root="1.2.752.129.2.1.4.1" extension="HSAid"/>
            <name>Jonas Dahl</name>
        </staff>
        <typeOfStaff code="LK" codeSystem="1.2.752.97.3.2.8.8" />
        <staffOrganisation>            
            <careUnitId root="1.2.752.129.2.1.4.1" extension="HSAid"/>
            <careUnitName>Hässelby vårdcentral</careUnitName>
        </staffOrganisation>
    </intermediary>
    
    <additionalInformation>
        <desiredRequestRecipient>Vederbörande husläkare</desiredRequestRecipient>
        <interpreterRequirement>Behöver finsk tolk.</interpreterRequirement>
    </additionalInformation>
    
    <awarenessInformation>
        <text>Har hepatit C.</text>
    </awarenessInformation>
    
    <questionFormulation>
        <id root="1.2.752.129.2.1.2.1" extension="2"/>
        <text>Diabetes?</text>
        <clinicalInformation>
            <id root="1.2.752.129.2.1.2.1" extension="2"/>
            <description>33-årig blandmissbrukande man som inkom 11/3 pga centrala bröstsmärtor. Patienten har vårdats inneliggande under ett dygn och hjärtinfarkt har uteslutits. Smärtorna bedöms som muskuloskelettala. Under vårdtiden har förhöjda blodsockervärden uppmätts vid flera tillfällen som högst 10,8. Patienten har ingen känd diabetes. Tacksam för uppföljning av patientens förhöjda blodsockervärden.

                Vänliga hälsningar
                Elin EK
                AT-läkare
            </description>
        </clinicalInformation>
    </questionFormulation>
</request>
