<?xml version="1.0" encoding="UTF-8"?>
<!-- SLL eRemiss testcase 8-->
<requestOutcome xmlns:gcda="AlschulerAssociates::GreenCDA" xmlns:gcdan="AlschulerAssociates::GreenCDA::Narrative" xmlns="urn:riv:clinicalprocess:requestworkflow:request"
                xsi:schemaLocation="urn:riv:clinicalprocess:requestworkflow:request remiss.xsd" xmlns:xsi="http://www.w3.org/2001/XMLSchema-instance">
    <requestId root="1.2.752.129.2.1.2.1" extension="testfall8"/>
    <requestOutcomeId root="1.2.752.129.2.1.2.1" extension="testfall7"/>
    <typeOfRequestOutcome code="RB" codeSystem="1.2.752.97.3.2.8.6"/>
    <versionTimeStamp value="201203011636"/>
    <versionNumber>1</versionNumber>
    
    <author>
        <dateOfRequest value="20120315"/>
        <staff>
            <id root="1.2.752.129.2.1.4.1" extension="HSAid"/>
            <name>Jonas Dahl</name>
        </staff>
        <staffOrganisation>
            <careUnitId root="1.2.752.97.3.1.1" extension="HSAid"/>
            <careUnitName>Hässelby vårdcentral</careUnitName>
        </staffOrganisation>
        <legalAuthenticator>
            <timeOfSigning value="201204301233"/>
            <signature>
                <id root="1.2.752.129.2.1.4.1" extension="HSA-id for signer"/>
                <name>Jonas Dahl</name>
            </signature>
        </legalAuthenticator>
    </author>
        
    <recipient>
        <organisation>
            <careUnitId root="1.2.752.129.2.1.4.1" extension="HSA-id for recipient of reuqest"/>
            <careUnitName>Capio S:t Görans sjukhus, Ortopedmottagningen</careUnitName>
        </organisation>
    </recipient>
    

    <outcome>
    </outcome>
</requestOutcome>
