<?xml version="1.0" encoding="UTF-8"?>
<request xmlns:gcda="AlschulerAssociates::GreenCDA" xmlns:gcdan="AlschulerAssociates::GreenCDA::Narrative" xmlns="urn:riv:clinicalprocess:requestworkflow:request"
         xsi:schemaLocation="urn:riv:clinicalprocess:requestworkflow:request remiss.xsd" xmlns:xsi="http://www.w3.org/2001/XMLSchema-instance">
             
    <requestId root="1.2.752.129.2.1.2.1" extension="abc123"/>
    <typeOfRequest code="4" codeSystem="1.2.752.129.2.2.2.24"/>
    <versionTimeStamp value="201203121636"/>
    <versionNumber>1</versionNumber>
    <reasonForVersion>
        <typeOfReason code="NR" codeSystem="1.2.752.97.3.2.8.5"/>
    </reasonForVersion>

    <patient>
        <personId root="1.2.752.97.3.1.2" extension="197907179191"/>
        <address>
            <careOf>Mikkonen</careOf>
            <streetName1>Astrakangatan 14</streetName1>
            <postalCode>16565</postalCode>
            <postalCity>Hässelby</postalCity>
        </address>
        <telecom>
            <typeOfTelecom code="MC" codeSystem="1.2.752.129.2.2.1.30"/>
            <number>+46706123123</number>
        </telecom>
        <!-- Efternamn/mellannamn/tilltalsnamn/förnamn -->
        <name>Testsson/Vårdtest//</name>
        <gender code="1" codeSystem="1.2.752.129.2.2.1.1"/>
        <dateOfBirth value="19790917"/>
    </patient>

    <author>
        <!-- Maps to clinicalDocument/author/time -->                               
        <dateOfRequest value="20120312"/>
        <!-- No mapping for clinicalDocument/author/assignedAuthor -->                               
        <staff>
           <!-- Maps to clinicalDocument/author/assignedAuthor/id --> 
            <id root="1.2.752.129.2.1.4.1" extension="HSAid Remittent"/>
            <!-- Maps to clinicalDocument/author/assignedAuthor/assignedPerson/name -->                               
            <name>Elin Ek</name>
        </staff>
        <!-- Maps to clinicalDocument/author/assignedAuthor/code -->                               
        <typeOfStaff code="LK" codeSystem="1.2.752.97.3.2.8.8"/>
        <staffOrganisation>
            <!-- Maps to clinicalDocument/author/assignedAuthor/representedOrganization/id -->                                     
            <careUnitId root="1.2.752.129.2.1.4.1" extension="HSA-id for RT organization"/>
            <!-- Maps to clinicalDocument/author/assignedAuthor/representedOrganization/name -->                                     
            <careUnitName>Avd 33, Medicinkliniken, Capio S:t Görans sjukhus</careUnitName>
        </staffOrganisation>
        
        <legalAuthenticator>
            <timeOfSigning value="201203121122"/>
            <signature>
                <id root="1.2.752.129.2.1.4.1" extension="HSA-id for signer" />
                <name>Elin Ek</name>
            </signature>
        </legalAuthenticator>
    </author>

    <recipient>
        <organisation>
            <!-- Maps to clinicalDocument/informationRecipient/receivedOrganization/id -->                                     
            <careUnitId root="1.2.752.129.2.1.4.1" extension="HSA-id for recipient organization"/>
            <!-- Maps to clinicalDocument/informationRecipient/receivedOrganization/name -->                                     
            <careUnitName>Hasselby vårdcentral</careUnitName>
        </organisation>
    </recipient>

    <additionalInformation>
        <desiredDateForPerformance start="20120501" end="20120601" />
        <desiredRequestRecipient>Vederbörande husläkare</desiredRequestRecipient>                
        <interpreterRequirement>Behöver finsk tolk.</interpreterRequirement>
    </additionalInformation>

    <awarenessInformation>
        <text>Har hepatit C.</text>
	<!-- <clinicalInformation /> -->
    </awarenessInformation>

    <questionFormulation>
        <id root="1.2.752.129.2.1.2.1" extension="1"/>
        <text>Diabetes?</text>
        <!-- <desiredAction/> -->
        <clinicalInformation>
            <id root="1.2.752.129.2.1.2.1" extension="1"/>
            <description>33-årig blandmissbrukande man som inkom 11/3 pga centrala bröstsmärtor. Patienten har vårdats inneliggande under ett dygn och hjärtinfarkt har uteslutits. Smärtorna bedöms som muskuloskelettala. Under vårdtiden har förhöjda blodsockervärden uppmätts vid flera tillfällen som högst 10,8. Patienten har ingen känd diabetes. Tacksam för uppföljning av patientens förhöjda blodsockervärden.

                Vänliga hälsningar
                Elin EK
                AT-läkare
            </description>
        </clinicalInformation>
    </questionFormulation>
</request>
