<?xml version="1.0" encoding="UTF-8"?>
<!-- SLL eRemiss testcase 7 -->
<request xmlns:gcda="AlschulerAssociates::GreenCDA" xmlns:gcdan="AlschulerAssociates::GreenCDA::Narrative" xmlns="urn:riv:clinicalprocess:requestworkflow:request"
         xsi:schemaLocation="urn:riv:clinicalprocess:requestworkflow:request remiss.xsd" xmlns:xsi="http://www.w3.org/2001/XMLSchema-instance">

    <requestId root="1.2.752.129.2.1.2.1" extension="testfall7"/>
    <typeOfRequest code="4" codeSystem="1.2.752.129.2.2.2.24"/>
    <versionTimeStamp value="201203011636"/>
    <versionNumber>1</versionNumber>
    
    <reasonForVersion>
        <typeOfReason code="NR" displayName="Ny request" codeSystem="1.2.752.97.3.2.8.5"/>        
    </reasonForVersion>

    <patient>
        <personId root="1.2.752.97.3.1.2" extension="197907179191"/>
        <address>
            <careOf>Mikkonen</careOf>	
            <streetName1>Astrakangatan 14</streetName1>
            <streetName2>Uppgång C</streetName2>
            <streetName3>Lgh 0014</streetName3>
            <postalCode>16565</postalCode>
            <postalCity>Hässelby</postalCity>
        </address>
        <telecom>
            <typeOfTelecom code="H" codeSystem="1.2.752.129.2.2.1.30"/>
            <number>+468123123</number>
        </telecom>
        <telecom>
            <typeOfTelecom code="MC" codeSystem="1.2.752.129.2.2.1.30"/>
            <number>+46706123123</number>
        </telecom>
        <!-- Efternamn/mellannamn/tilltalsnamn/förnamn -->
        <name>Testsson/Anders/Vårdtest/Vårdtest</name>
        <gender code="1" codeSystem="1.2.752.129.2.2.1.1"/>
        <dateOfBirth value="19790917"/>

    </patient>
    
    <author>
        <dateOfRequest value="20120315"/>
        
        <legalAuthenticator>
            <timeOfSigning value="201203151233"/>
            <signature>
                <id />
                <name>Jonas Dahl, Distriktsläkare</name> 
            </signature>
        </legalAuthenticator>
    </author>
    
    <recipient>
       <!-- <requestrolltyp code="SM" displayName="Svarsmottagare" codeSystem="1.2.752.97.3.2.8.4"/> -->
        <id root="1.2.752.97.3.1.1" extension="HSAid"/>
        <name>Jonas Dahl</name>
        <careUnitId root="1.2.752.129.2.1.4.1" extension="HSAid"/>
        <vardgivarid root="1.2.752.129.2.1.4.1" extension="HSAid"/>
        <lansid root="1.2.752.129.2.1.4.1" extension="HSAid"/>
        <careUnitName>Hässelby vårdcentral</careUnitName>
        <typeOfStaff code="LK" codeSystem="1.2.752.97.3.2.8.8" />
    </recipient>
    
    <additionalInformation>
        <text>Patienten är bortrest utomlands 2012-03-15 – 2012-04-14 och kan därför kallas tidigast 2012-04-15</text>
        <desiredDateForPerformance start="20120415" end="20120831"/>
        <desiredRequestRecipient>Specialistläkare inom ortopedi</desiredRequestRecipient>
        <interpreterRequirement>Behöver finsk tolk.</interpreterRequirement>
    </additionalInformation>
    
    <awarenessInformation>
        <text>Har hepatit C.</text>
    </awarenessInformation>
    
    <involverarroller>
        <rollinstansid root="1.2.752.97.x.x.x.x" extension="123"/>
        <requestrolltyp code="RB" displayName="Remissbedömare" codeSystem="1.2.752.97.3.2.8.4"/>
        <name>Robert Larsson</name>
        <careUnitId root="1.2.752.129.2.1.4.1" extension="HSAid"/>
        <vardgivarid root="1.2.752.129.2.1.4.1" extension="HSAid"/>
        <lansid root="1.2.752.129.2.1.4.1" extension="HSAid"/>
        <careUnitName>Capio S:t Görans sjukhus, Ortopedmottagningen</careUnitName>
        <typeOfStaff code="LK" codeSystem="1.2.752.97.3.2.8.8" />
    </involverarroller>

    <questionFormulation>
        <id root="1.2.752.129.2.1.2.1" extension="7"/>
        <text>Meniskskada? Korsbandsskada?</text>
        <clinicalInformation>
            <id root="1.2.752.129.2.1.2.1" extension="7"/>
            <!-- <tillstand code="S83.6" displayName="Tillstånd XXX" codeSystem="1.2.752.97.x.x.x.x"/> -->
            <description>33-årig blandmissbrukande man som ramlade omkring 1 februari i berusat tillstånd och på något sätt skadat höger knä. Ej sökt vård. Sedan dess har patienten haft intermittent svullnad av höger knä och låsningsfenomen. I status noteras måttlig hydrops, kraftig smärta vid meniskprovokationstest och misstänkt främre draglåda. Röntgenundersökning har inte visat något patologiskt. Har ej genomgått MR. Tacksam för bedömning och ställningstagande till artroskopi.

                Hälsningar
                Jonas Dahl
                Distriktsläkare
            </description>
            <!--
            <atgarder>
                <atgardid root="1.2.752.97.x.x.x.x" extension="123"/>
                <atgardtyp code="NGA11" displayName="Åtgärdskod XXX" codeSystem="1.2.752.97.x.x.x.x"/>
                <atgarddescription>Artroskopi höger knä</atgarddescription>
            </atgarder>
            -->
        </clinicalInformation>
    </questionFormulation>
</request>
