<?xml version="1.0" encoding="UTF-8"?>
<!-- SLL eRemiss testcase 4 -->
<request xmlns:gcda="AlschulerAssociates::GreenCDA" xmlns:gcdan="AlschulerAssociates::GreenCDA::Narrative" xmlns="urn:riv:clinicalprocess:requestworkflow:request"
         xsi:schemaLocation="urn:riv:clinicalprocess:requestworkflow:request remiss.xsd" xmlns:xsi="http://www.w3.org/2001/XMLSchema-instance">
             
    <requestId root="1.2.752.129.2.1.2.1" extension="testfall4"/>
    <typeOfRequest code="4" codeSystem="1.2.752.129.2.2.2.24"/>
    <versionTimeStamp value="201203151636"/>
    <versionNumber>1</versionNumber>
    
    <reasonForVersion>
        <typeOfReason code="NR" codeSystem="1.2.752.97.3.2.8.5" />
        <text>Ny remiss</text>
    </reasonForVersion>

    <!-- Patient -->
    <patient>
        <personId root="1.2.752.97.3.1.2" extension="197907179191"/>

        <address>
            <careOf>Mikkonen</careOf>
            <streetName1>Astrakangatan 14</streetName1>
            <streetName2>Uppgång C</streetName2>
            <streetName3>Lgh 0014</streetName3>
            <postalCode>165 65</postalCode>
            <postalCity>Hässelby</postalCity>
        </address>
        
        <telecom>
            <typeOfTelecom code="H" codeSystem="1.2.752.129.2.2.1.30"/>
            <number>+468123123</number>
        </telecom>
        <telecom>
            <typeOfTelecom code="MC" codeSystem="1.2.752.129.2.2.1.30"/>
            <number>+46706123123</number>
        </telecom>
        <!-- Efternamn/mellannamn/tilltalsnamn/förnamn -->
        <name>Testsson/Anders/Vårdtest/Vårdtest</name>
        <gender code="1" codeSystem="1.2.752.129.2.2.1.1"/>
        <dateOfBirth value="19790917"/>
    </patient>
    
    <author>
        <dateOfRequest value="20120315"/>
        
        <staff>
            <id root="1.2.752.129.2.1.4.1" extension="HSA-id for RT"/>
            <name>Jonas Dahl</name>     
        </staff>
        <typeOfStaff code="LK" codeSystem="1.2.752.97.3.2.8.8" />
        <staffOrganisation>
            <careUnitId root="1.2.752.129.2.1.4.1" extension="HSAid"/>
            <careUnitName>Hässelby vårdcentral</careUnitName>
        </staffOrganisation>
        <legalAuthenticator>
            <timeOfSigning value="201203151233"/>            
            <signature>
                <id root="1.2.752.129.2.1.4.1" extension="HSA-id for signer"/>
                <name>Jonas Dahl</name>
            </signature>
        </legalAuthenticator>
    </author>
    
    <recipient>
        <organisation>     
            <careUnitId root="1.2.752.129.2.1.4.1" extension="HSAid"/>
            <careUnitName>Capio S:t Görans sjukhus, Ortopedmottagningen</careUnitName>
        </organisation>
    </recipient>
    
    <additionalInformation>
        <desiredDateForPerformance start="20120415" end="20120831" />
        <desiredRequestRecipient>Specialistläkare inom ortopedi</desiredRequestRecipient>
        <administrativeInformation>Patienten är bortrest utomlands 2012-03-15 – 2012-04-14 och kan därför kallas tidigast 2012-04-15</administrativeInformation>
        <interpreterRequirement>Behöver finsk tolk.</interpreterRequirement>
    </additionalInformation>
    
    <awarenessInformation>
        <text>Har hepatit C.</text>
    </awarenessInformation>

    <questionFormulation>
        <id root="1.2.752.129.2.1.2.1" extension="4"/>
        <text>Meniskskada? Korsbandsskada?</text>
        <desiredAction>
            <id root="1.2.752.97.3.1.11" extension="NGA11"></id>
            <description>Artroskopi höger knä</description>
        </desiredAction>
        <clinicalInformation>
            <id root="1.2.752.129.2.1.2.1" extension="4"/>
            <condition root="1.2.752.116.1.1.1.1.3" extension="S83.6" />
            <description>33-årig blandmissbrukande man som ramlade omkring 1 februari i berusat tillstånd och på något sätt skadat höger knä. Ej sökt vård. Sedan dess har patienten haft intermittent svullnad av höger knä och låsningsfenomen. I status noteras måttlig hydrops, kraftig smärta vid meniskprovokationstest och misstänkt främre draglåda. Röntgenundersökning har inte visat något patologiskt. Har ej genomgått MR. Tacksam för bedömning och ställningstagande till artroskopi.

                Hälsningar
                Jonas Dahl
                Distriktsläkare
            </description>
            
        </clinicalInformation>
    </questionFormulation>
</request>